NAME,URL,Total Upvotes,Total Answers,Reference
WSO2 1.8 rejecting API call with 101508 & 303001 error codes,https://stackoverflow.com/questions/70535912/wso2-1-8-rejecting-api-call-with-101508-303001-error-codes,0,0,1
How do I install imagemagick to php on linux homebrew?,https://stackoverflow.com/questions/70535911/how-do-i-install-imagemagick-to-php-on-linux-homebrew,0,1,1
sqlsrv_connect function returns empty string,https://stackoverflow.com/questions/70535910/sqlsrv-connect-function-returns-empty-string,0,0,1
Why does getNdefMessage() returns null even though debugger shows ndef object has a message payload that is supposedly correctly formatted?,https://stackoverflow.com/questions/70535906/why-does-getndefmessage-returns-null-even-though-debugger-shows-ndef-object-ha,0,1,1
"Exception in thread ""main"" java.lang.NoClassDefFoundError: org/bukkit/configuration/file/YamlConfiguration",https://stackoverflow.com/questions/70535903/exception-in-thread-main-java-lang-noclassdeffounderror-org-bukkit-configurat,0,1,1
How to call database().ref() method in Firebase Config firebase V9,https://stackoverflow.com/questions/70535901/how-to-call-database-ref-method-in-firebase-config-firebase-v9,0,1,1
серевер телеграма отправляет по нескольку раз одни и те же сообщения [closed],https://stackoverflow.com/questions/70535899/%d1%81%d0%b5%d1%80%d0%b5%d0%b2%d0%b5%d1%80-%d1%82%d0%b5%d0%bb%d0%b5%d0%b3%d1%80%d0%b0%d0%bc%d0%b0-%d0%be%d1%82%d0%bf%d1%80%d0%b0%d0%b2%d0%bb%d1%8f%d0%b5%d1%82-%d0%bf%d0%be-%d0%bd%d0%b5%d1%81%d0%ba%d0%be%d0%bb%d1%8c%d0%ba%d1%83-%d1%80%d0%b0%d0%b7-%d0%be%d0%b4%d0%bd%d0%b8-%d0%b8-%d1%82%d0%b5-%d0%b6%d0%b5-%d1%81%d0%be%d0%be%d0%b1%d1%89%d0%b5%d0%bd%d0%b8%d1%8f,-4,0,1
spring boot basic authentication not work,https://stackoverflow.com/questions/70535898/spring-boot-basic-authentication-not-work,0,0,1
How to easily enable/disable Chrome/Eclipse debugger?,https://stackoverflow.com/questions/70535895/how-to-easily-enable-disable-chrome-eclipse-debugger,0,1,1
find the difference between 2 tables in oracle with different column numbers,https://stackoverflow.com/questions/70535896/find-the-difference-between-2-tables-in-oracle-with-different-column-numbers,0,1,1
Update JsonNode with new object values,https://stackoverflow.com/questions/70535894/update-jsonnode-with-new-object-values,0,0,1
Invalid SOAP message or SOAP version mismatch - maybe due to xop:Include?,https://stackoverflow.com/questions/70535890/invalid-soap-message-or-soap-version-mismatch-maybe-due-to-xopinclude,0,0,1
Best way to create Custom (Octagonal) UIButton in Swift,https://stackoverflow.com/questions/70535888/best-way-to-create-custom-octagonal-uibutton-in-swift,-1,0,1
django how to create a serializer ListField that accepts DictField with images values,https://stackoverflow.com/questions/70535885/django-how-to-create-a-serializer-listfield-that-accepts-dictfield-with-images-v,0,0,1
Check for username without login/user_credential,https://stackoverflow.com/questions/70535884/check-for-username-without-login-user-credential,0,1,1
Testing Angular Component with [(ngModel)] binding fails,https://stackoverflow.com/questions/70535881/testing-angular-component-with-ngmodel-binding-fails,0,0,1
EF Core result streaming: AsEnumerable vs AsAsyncEnumerable,https://stackoverflow.com/questions/70535876/ef-core-result-streaming-asenumerable-vs-asasyncenumerable,1,0,1
Gradle cannot access ClassName of submodule,https://stackoverflow.com/questions/70535872/gradle-cannot-access-classname-of-submodule,0,0,1
Is it possible to wrap a function so that the wrapper has the same arguments plus another argument which is situated after these arguments?,https://stackoverflow.com/questions/70535870/is-it-possible-to-wrap-a-function-so-that-the-wrapper-has-the-same-arguments-plu,1,1,1
How to group by 2 things in mysql [closed],https://stackoverflow.com/questions/70535868/how-to-group-by-2-things-in-mysql,-3,0,1
Shiny seesion object is not found when trying to use shinyJS(),https://stackoverflow.com/questions/70535867/shiny-seesion-object-is-not-found-when-trying-to-use-shinyjs,0,0,1
Error when trying to use seasonal_decompose from Statsmodels,https://stackoverflow.com/questions/70535865/error-when-trying-to-use-seasonal-decompose-from-statsmodels,0,0,1
Android Resource linking failed in AndroidManifest.xml file,https://stackoverflow.com/questions/70535864/android-resource-linking-failed-in-androidmanifest-xml-file,-1,0,1
node.js require() cache - possible to invalidate?,https://stackoverflow.com/questions/70535863/discard-and-re-import-dynamic-import,366,19,1
Resolving Typescript types at runtime,https://stackoverflow.com/questions/70535858/resolving-typescript-types-at-runtime,1,1,1
Working with JSON in Python - Cannot Get to Correct Data Level,https://stackoverflow.com/questions/70535857/working-with-json-in-python-cannot-get-to-correct-data-level,0,1,1
Android Coroutine: Revert all the job if anyone job failed,https://stackoverflow.com/questions/70535854/android-coroutine-revert-all-the-job-if-anyone-job-failed,0,0,1
Lodash import function not found,https://stackoverflow.com/questions/70535852/lodash-import-function-not-found,0,0,1
Java Swing components no longer appear after changing unrelated code,https://stackoverflow.com/questions/70535851/java-swing-components-no-longer-appear-after-changing-unrelated-code,0,0,1
How can I recreate this particular animation with css and when necessary javascript?,https://stackoverflow.com/questions/70535843/how-can-i-recreate-this-particular-animation-with-css-and-when-necessary-javascr,0,0,1
There is no ViewData item of type 'IEnumerable<SelectListItem>' that has the key 'SessionSelect',https://stackoverflow.com/questions/70535841/there-is-no-viewdata-item-of-type-ienumerableselectlistitem-that-has-the-key,0,0,1
Error while login using php & phpmyadmin database,https://stackoverflow.com/questions/70535838/error-while-login-using-php-phpmyadmin-database,0,1,1
Visual Studio Code Run program in Terminal for Input,https://stackoverflow.com/questions/70535837/how-to-run-c-in-visual-studio-code-terminal,1,1,1
Layout is jumbled in flutter,https://stackoverflow.com/questions/70535836/layout-is-jumbled-in-flutter,0,0,1
Reducing a nested loop,https://stackoverflow.com/questions/70535835/reducing-a-nested-loop,0,1,1
npm leftover package cannot remove from cache,https://stackoverflow.com/questions/70535833/npm-leftover-package-cannot-remove-from-cache,0,0,1
"Express and Mongoose - How to condition search with ""where"" based on populated nested object",https://stackoverflow.com/questions/70535830/express-and-mongoose-how-to-condition-search-with-where-based-on-populated-n,0,0,1
How to make background image move with mousemove,https://stackoverflow.com/questions/70535829/how-to-make-background-image-move-with-mousemove,0,0,1
I couldn't identify if it is a hardcoded code [closed],https://stackoverflow.com/questions/70535826/i-couldnt-identify-if-it-is-a-hardcoded-code,-3,0,1
"Copying list ""ties"" the original list",https://stackoverflow.com/questions/70535823/copying-list-ties-the-original-list,0,2,1
"Using react-native-router, redirecting to different pages not working",https://stackoverflow.com/questions/70535818/using-react-native-router-redirecting-to-different-pages-not-working,2,1,1
Trigger javascript with buttons without onclick attribute,https://stackoverflow.com/questions/70535816/trigger-javascript-with-buttons-without-onclick-attribute,0,1,1
Optimizing Sums of Parts Java script function for Code Wars,https://stackoverflow.com/questions/70535813/optimizing-sums-of-parts-java-script-function-for-code-wars,0,0,1
"error UNHANDLED REJECTION ENOENT: no such file or directory, open '/vercel/path0/.cache/json/",https://stackoverflow.com/questions/70535812/error-unhandled-rejection-enoent-no-such-file-or-directory-open-vercel-path0,0,0,1
Erros cors with nestjs,https://stackoverflow.com/questions/70535809/erros-cors-with-nestjs,0,0,1
How to return the response from an asynchronous call,https://stackoverflow.com/questions/70535808/exported-function-returns-undefined,6231,42,1
Tensorflow get_file unpacks/extracts to a directory one level above specified,https://stackoverflow.com/questions/70535807/tensorflow-get-file-unpacks-extracts-to-a-directory-one-level-above-specified,0,0,1
If flux can deal with 0-N elements then why there is mono in project reactor? [duplicate],https://stackoverflow.com/questions/70535806/if-flux-can-deal-with-0-n-elements-then-why-there-is-mono-in-project-reactor,0,1,1
How do I read a file in javascript and then display it in html? [closed],https://stackoverflow.com/questions/70535802/how-do-i-read-a-file-in-javascript-and-then-display-it-in-html,-1,1,1
Connection Refused Cloud SQL Proxy Docker,https://stackoverflow.com/questions/70535801/connection-refused-cloud-sql-proxy-docker,0,0,1
Google Cloud - Load testing /QA team /,https://stackoverflow.com/questions/70549818/google-cloud-load-testing-qa-team,0,0,1
I can't add my app to google play: Issue: Need login credentials for app review,https://stackoverflow.com/questions/70549815/i-cant-add-my-app-to-google-play-issue-need-login-credentials-for-app-review,0,0,1
Jmespath join nested array,https://stackoverflow.com/questions/70549813/jmespath-join-nested-array,0,0,1
Snake Game going too fast console c++,https://stackoverflow.com/questions/70549812/snake-game-going-too-fast-console-c,0,0,1
Manually create React SSR Dom attributes,https://stackoverflow.com/questions/70549811/manually-create-react-ssr-dom-attributes,0,0,1
"Laravel, how to insert into pivot table",https://stackoverflow.com/questions/70549807/laravel-how-to-insert-into-pivot-table,0,0,1
Error in Django -- if max_value is not None and max_value < 0.: TypeError: '<' not supported between instances of 'dict' and 'float',https://stackoverflow.com/questions/70549805/error-in-django-if-max-value-is-not-none-and-max-value-0-typeerror-n,0,0,1
"Create a VBA macro which removes in a word document a text which contains a number between two quotes ("")",https://stackoverflow.com/questions/70549803/create-a-vba-macro-which-removes-in-a-word-document-a-text-which-contains-a-numb,0,0,1
bugs when adding link in Draft js WYSIWYG,https://stackoverflow.com/questions/70549802/bugs-when-adding-link-in-draft-js-wysiwyg,0,0,1
Handling special characters in bash script,https://stackoverflow.com/questions/70549800/handling-special-characters-in-bash-script,0,0,1
how do I make a method that accepts a list of any type [c#],https://stackoverflow.com/questions/70549799/how-do-i-make-a-method-that-accepts-a-list-of-any-type-c,1,1,1
wrote a React code snippet to implement conditional rendering and am not able to update the state of {Left} and {Right},https://stackoverflow.com/questions/70554693/wrote-a-react-code-snippet-to-implement-conditional-rendering-and-am-not-able-to,0,0,1
How to enable an AppBar search by default on Flutter?,https://stackoverflow.com/questions/70554692/how-to-enable-an-appbar-search-by-default-on-flutter,0,0,1
there are 2 function in modelView both are impacting the textview . how to run only one in MVVM?,https://stackoverflow.com/questions/70554691/there-are-2-function-in-modelview-both-are-impacting-the-textview-how-to-run-o,0,0,1
