NAME,URL,Total Upvotes,Total Answers,Reference
Pandas groupby over consecutive duplicates,https://stackoverflow.com/questions/70536170/pandas-groupby-over-consecutive-duplicates,0,0,1
"Django one to many models - How to create the ""many"" when the ""one"" is created?",https://stackoverflow.com/questions/70536169/django-one-to-many-models-how-to-create-the-many-when-the-one-is-created,0,0,1
Efficiently join one large table(1TB) and other small table(250GB) in spark,https://stackoverflow.com/questions/70536168/efficiently-join-one-large-table1tb-and-other-small-table250gb-in-spark,0,0,1
"Bug with unity 2D Lights (Experimental) on some devices (Ulefone, Xiaomi, etc.)",https://stackoverflow.com/questions/70536167/bug-with-unity-2d-lights-experimental-on-some-devices-ulefone-xiaomi-etc,0,0,1
how many possible triangles with a given stick? looking for high performance code,https://stackoverflow.com/questions/70536166/how-many-possible-triangles-with-a-given-stick-looking-for-high-performance-cod,0,0,1
Unable to use write.table in a function,https://stackoverflow.com/questions/70536163/unable-to-use-write-table-in-a-function,0,0,1
Javascript mapping append variable to DIV String,https://stackoverflow.com/questions/70536161/javascript-mapping-append-variable-to-div-string,0,0,1
Vuetify problems with the width of a v-col,https://stackoverflow.com/questions/70536160/vuetify-problems-with-the-width-of-a-v-col,0,0,1
Can you put code on a worksheet and make this an add-in?,https://stackoverflow.com/questions/70536153/can-you-put-code-on-a-worksheet-and-make-this-an-add-in,0,0,1
Nginx only renders index page. No other routes are rendered,https://stackoverflow.com/questions/70536148/nginx-only-renders-index-page-no-other-routes-are-rendered,0,0,1
Publicly Exposing an API Endpoint,https://stackoverflow.com/questions/70536147/publicly-exposing-an-api-endpoint,0,0,1
I need to update an access database with information from an Excel file,https://stackoverflow.com/questions/70536144/i-need-to-update-an-access-database-with-information-from-an-excel-file,-1,0,1
Python Filetype Search on Multiple Drives [closed],https://stackoverflow.com/questions/70536141/python-filetype-search-on-multiple-drives,-2,0,1
Implement REST API with Django,https://stackoverflow.com/questions/70536140/implement-rest-api-with-django,0,0,1
Including pybind and include Python.h,https://stackoverflow.com/questions/70536139/including-pybind-and-include-python-h,0,0,1
python map over list of tuples,https://stackoverflow.com/questions/70536138/python-map-over-list-of-tuples,1,1,1
"""Masking"" animation inside a div",https://stackoverflow.com/questions/70536136/masking-animation-inside-a-div,0,0,1
Is there a configuration to control the rate of calls between a VS C# Specflow Test Case and an Appium Server,https://stackoverflow.com/questions/70536131/is-there-a-configuration-to-control-the-rate-of-calls-between-a-vs-c-sharp-specf,0,0,1
Form.as_p works fine but individual form fields is not submitting correctly,https://stackoverflow.com/questions/70536128/form-as-p-works-fine-but-individual-form-fields-is-not-submitting-correctly,0,0,1
how to crontably reboot a linux host upon network failure?,https://stackoverflow.com/questions/70536127/how-to-crontably-reboot-a-linux-host-upon-network-failure,0,0,1
Calculating median with a GROUP BY in MariaDB,https://stackoverflow.com/questions/70536123/calculating-median-with-a-group-by-in-mariadb,0,0,1
A merge conflicted on path (Angular),https://stackoverflow.com/questions/70536122/a-merge-conflicted-on-path-angular,0,0,1
Ajax json doesnt show any instances,https://stackoverflow.com/questions/70536121/ajax-json-doesnt-show-any-instances,0,0,1
Optimize web scraping with Rselenium,https://stackoverflow.com/questions/70536118/optimize-web-scraping-with-rselenium,0,0,1
SQL Server date range search issue,https://stackoverflow.com/questions/70536117/sql-server-date-range-search-issue,0,0,1
Installing php5.6-mbstring on Ubuntu 16.04,https://stackoverflow.com/questions/70536116/installing-php5-6-mbstring-on-ubuntu-16-04,0,0,1
Cannot convert a symbolic Tensor (random_zoom_9/zoom_matrix/strided_slice:0) to a numpy array,https://stackoverflow.com/questions/70536115/cannot-convert-a-symbolic-tensor-random-zoom-9-zoom-matrix-strided-slice0-to,0,0,1
Build LernaJS monorepo with a Dockerfile,https://stackoverflow.com/questions/70536111/build-lernajs-monorepo-with-a-dockerfile,0,0,1
How to get a kivy variable added to Screen from add widget(),https://stackoverflow.com/questions/70536112/how-to-get-a-kivy-variable-added-to-screen-from-add-widget,0,0,1
Creating a scatterplot with the bottom right value of a matrix,https://stackoverflow.com/questions/70536108/creating-a-scatterplot-with-the-bottom-right-value-of-a-matrix,0,0,1
Chai testing TypeError: Converting circular structure to JSON,https://stackoverflow.com/questions/70536106/chai-testing-typeerror-converting-circular-structure-to-json,0,0,1
StatusBar animated={false} not working when hiding or showing the bar,https://stackoverflow.com/questions/70536105/statusbar-animated-false-not-working-when-hiding-or-showing-the-bar,0,0,1
Refresh Token is an Empty String,https://stackoverflow.com/questions/70536103/refresh-token-is-an-empty-string,0,0,1
TomTom Routing API is returning a weird optmized route,https://stackoverflow.com/questions/70536102/tomtom-routing-api-is-returning-a-weird-optmized-route,-1,0,1
Android workmanager only executes 1 or 2 times,https://stackoverflow.com/questions/70536100/android-workmanager-only-executes-1-or-2-times,0,0,1
Athena Date Partition Without Extra Bits,https://stackoverflow.com/questions/70536096/athena-date-partition-without-extra-bits,0,0,1
Python: py.test --pep8 operates in incorrect file?,https://stackoverflow.com/questions/70536095/python-py-test-pep8-operates-in-incorrect-file,0,0,1
Regex that accepts only numbers three letters-and 6 digit number,https://stackoverflow.com/questions/70536093/regex-that-accepts-only-numbers-three-letters-and-6-digit-number,0,0,1
Looping through list and inserting on condition is freezing,https://stackoverflow.com/questions/70536088/looping-through-list-and-inserting-on-condition-is-freezing,1,0,1
"PowerBi Report Builder (Paginated Report) to ""ALL"" inside Single Selection Parameter",https://stackoverflow.com/questions/70536087/powerbi-report-builder-paginated-report-to-all-inside-single-selection-param,0,0,1
Fallback font size is VSCode,https://stackoverflow.com/questions/70536086/fallback-font-size-is-vscode,0,0,1
Find all possible calculations to get a required number,https://stackoverflow.com/questions/70536079/find-all-possible-calculations-to-get-a-required-number,0,1,1
How to enable StatsD in Spring Boot?,https://stackoverflow.com/questions/70536077/how-to-enable-statsd-in-spring-boot,0,0,1
Dynamic templates not populating contact information,https://stackoverflow.com/questions/70536076/dynamic-templates-not-populating-contact-information,0,0,1
Why are unicode characters not appearing in java?,https://stackoverflow.com/questions/70536072/why-are-unicode-characters-not-appearing-in-java,0,0,1
How to highlight certain text in XTEXT runtime instance,https://stackoverflow.com/questions/70536070/how-to-highlight-certain-text-in-xtext-runtime-instance,0,0,1
"how to check & authenticate received Emails with Google Gmail API?, To avoid spoofing",https://stackoverflow.com/questions/70536068/how-to-check-authenticate-received-emails-with-google-gmail-api-to-avoid-spo,0,0,1
This elementary example of sentential calculus in an encyclopedia article (SEP) escapes me,https://stackoverflow.com/questions/70536067/this-elementary-example-of-sentential-calculus-in-an-encyclopedia-article-sep,0,0,1
c++ 2D vector(matrix) how to delete the nth row?,https://stackoverflow.com/questions/70536066/c-2d-vectormatrix-how-to-delete-the-nth-row,-1,2,1
why am I getting null when trying to get a link token from plaid?,https://stackoverflow.com/questions/70536065/why-am-i-getting-null-when-trying-to-get-a-link-token-from-plaid,0,0,1
Using position:fixed in a table,https://stackoverflow.com/questions/70536178/using-positionfixed-in-a-table,0,0,1
Toggle Animation Function on JavaScript not working,https://stackoverflow.com/questions/70536177/toggle-animation-function-on-javascript-not-working,0,0,1
AZ Custom Handler No connection could be made because the target machine actively refused it,https://stackoverflow.com/questions/70536172/az-custom-handler-no-connection-could-be-made-because-the-target-machine-activel,0,0,1
Extract data from terminal command,https://stackoverflow.com/questions/70536171/extract-data-from-terminal-command,0,0,1
Adding HTML entities using CSS content,https://stackoverflow.com/questions/190396/adding-html-entities-using-css-content,1085,9,1
Space between two rows in a table?,https://stackoverflow.com/questions/351058/space-between-two-rows-in-a-table,810,28,1
HTML table: keep the same width for columns,https://stackoverflow.com/questions/570154/html-table-keep-the-same-width-for-columns,83,4,1
CSS3's border-radius property and border-collapse:collapse don't mix. How can I use border-radius to create a collapsed table with rounded corners?,https://stackoverflow.com/questions/628301/css3s-border-radius-property-and-border-collapsecollapse-dont-mix-how-can-i,357,26,1
How do I give text or an image a transparent background using CSS?,https://stackoverflow.com/questions/806000/how-do-i-give-text-or-an-image-a-transparent-background-using-css,2426,33,1
Center a position:fixed element,https://stackoverflow.com/questions/2005954/center-a-positionfixed-element,516,21,1
How to disable a link using only CSS,https://stackoverflow.com/questions/2091168/how-to-disable-a-link-using-only-css,897,23,1
How can I transition height: 0; to height: auto; using CSS?,https://stackoverflow.com/questions/3508605/how-can-i-transition-height-0-to-height-auto-using-css,2499,57,1
How to style a checkbox using CSS,https://stackoverflow.com/questions/4148499/how-to-style-a-checkbox-using-css,975,40,1
How to keep indent for second line in ordered lists via CSS?,https://stackoverflow.com/questions/10428720/how-to-keep-indent-for-second-line-in-ordered-lists-via-css,305,14,1
How do JavaScript closures work?,https://stackoverflow.com/questions/111102/how-do-javascript-closures-work,7626,86,1
Remove properties from objects (JavaScript),https://stackoverflow.com/questions/208105/remove-properties-from-objects-javascript,6879,32,1
var functionName = function() {} vs function functionName() {},https://stackoverflow.com/questions/336859/var-functionname-function-vs-function-functionname,7331,41,1
Which equals operator (== vs ===) should be used in JavaScript comparisons?,https://stackoverflow.com/questions/359494/which-equals-operator-vs-should-be-used-in-javascript-comparisons,5656,48,1
What is the !! (not not) operator in JavaScript?,https://stackoverflow.com/questions/784929/what-is-the-not-not-operator-in-javascript,3715,38,1
How do I include a JavaScript file in another JavaScript file?,https://stackoverflow.com/questions/950087/how-do-i-include-a-javascript-file-in-another-javascript-file,5845,65,1
How to replace all occurrences of a string in JavaScript,https://stackoverflow.com/questions/1144783/how-to-replace-all-occurrences-of-a-string-in-javascript,5041,79,1
"What does ""use strict"" do in JavaScript, and what is the reasoning behind it?",https://stackoverflow.com/questions/1335851/what-does-use-strict-do-in-javascript-and-what-is-the-reasoning-behind-it,8066,29,1
How to check whether a string contains a substring in JavaScript?,https://stackoverflow.com/questions/1789945/how-to-check-whether-a-string-contains-a-substring-in-javascript,7418,3,1
For-each over an array in JavaScript,https://stackoverflow.com/questions/9329446/for-each-over-an-array-in-javascript,5230,40,1
"Azure Service Bus Sample ""No connection could be made because the target machine actively refused it""",https://stackoverflow.com/questions/7453319/azure-service-bus-sample-no-connection-could-be-made-because-the-target-machine,0,1,1
Simple static HTML server in Node,https://stackoverflow.com/questions/21081609/simple-static-html-server-in-node,0,3,1
Azure Table Storage - No connection could be made because the target machine actively refused it 127.0.0.1:10002,https://stackoverflow.com/questions/33765141/azure-table-storage-no-connection-could-be-made-because-the-target-machine-act,16,1,1
Postgresql: No connection could be made because the target machine actively refused it,https://stackoverflow.com/questions/38730065/postgresql-no-connection-could-be-made-because-the-target-machine-actively-refu,8,3,1
How to send github OAuth data to client?,https://stackoverflow.com/questions/54563147/how-to-send-github-oauth-data-to-client,0,1,1
Azure Function BlobTrigger: Microsoft.WindowsAzure.Storage: No connection could be made because the target machine actively refused it,https://stackoverflow.com/questions/58289366/azure-function-blobtrigger-microsoft-windowsazure-storage-no-connection-could,1,2,1
MongoDB no connection could be made because the target machine actively refused it,https://stackoverflow.com/questions/69573941/mongodb-no-connection-could-be-made-because-the-target-machine-actively-refused,0,1,1
How to execute a program or call a system command?,https://stackoverflow.com/questions/89228/how-to-execute-a-program-or-call-a-system-command,5562,62,1
How to print colored text to the terminal,https://stackoverflow.com/questions/287871/how-to-print-colored-text-to-the-terminal,2660,55,1
Getting the class name of an instance?,https://stackoverflow.com/questions/510972/getting-the-class-name-of-an-instance,1749,10,1
Proper way to declare custom exceptions in modern Python?,https://stackoverflow.com/questions/1319615/proper-way-to-declare-custom-exceptions-in-modern-python,1551,14,1
How to exclude a directory in find . command,https://stackoverflow.com/questions/4210042/how-to-exclude-a-directory-in-find-command,1744,45,1
How to reload .bash_profile from the command line?,https://stackoverflow.com/questions/4608187/how-to-reload-bash-profile-from-the-command-line,1124,14,1
How do I set a variable to the output of a command in Bash?,https://stackoverflow.com/questions/4651437/how-do-i-set-a-variable-to-the-output-of-a-command-in-bash,2058,14,1
Running shell command and capturing the output,https://stackoverflow.com/questions/4760215/running-shell-command-and-capturing-the-output,1175,21,1
"How to delete from a text file, all lines that contain a specific string?",https://stackoverflow.com/questions/5410757/how-to-delete-from-a-text-file-all-lines-that-contain-a-specific-string,2084,20,1
How do I copy a folder from remote to local using scp?,https://stackoverflow.com/questions/11304895/how-do-i-copy-a-folder-from-remote-to-local-using-scp,3032,12,1
.Net Runtime Not Downloading on Ubuntu Linux Server,https://stackoverflow.com/questions/70536058/net-runtime-not-downloading-on-ubuntu-linux-server,0,0,1
how can i solve a problem i cant access req.user.id,https://stackoverflow.com/questions/70536056/how-can-i-solve-a-problem-i-cant-access-req-user-id,0,0,1
WP Bootstrap Nav walker disappeared after reloading template,https://stackoverflow.com/questions/70536053/wp-bootstrap-nav-walker-disappeared-after-reloading-template,0,0,1
Question about how to pass a parameter within a dapper query call,https://stackoverflow.com/questions/70536052/question-about-how-to-pass-a-parameter-within-a-dapper-query-call,1,1,1
Apollo Explorer not reflecting changes in source code,https://stackoverflow.com/questions/70536051/apollo-explorer-not-reflecting-changes-in-source-code,0,0,1
Best way to create channel and dial created channel using ARI4Java in asterisk,https://stackoverflow.com/questions/70536048/best-way-to-create-channel-and-dial-created-channel-using-ari4java-in-asterisk,0,0,1
REST Assured don't log response body,https://stackoverflow.com/questions/70536047/rest-assured-dont-log-response-body,0,0,1
Modify one byte of PNG file,https://stackoverflow.com/questions/70536046/modify-one-byte-of-png-file,0,1,1
Tracking various instances of same button in wordpress with Tag Manager,https://stackoverflow.com/questions/70536042/tracking-various-instances-of-same-button-in-wordpress-with-tag-manager,0,0,1
Run equations and switch constant value,https://stackoverflow.com/questions/70536037/run-equations-and-switch-constant-value,0,0,1
How can I animate an accelerating a DOM element with JavaScript?,https://stackoverflow.com/questions/70536034/how-can-i-animate-an-accelerating-a-dom-element-with-javascript,0,0,1
Changing vertical position of characters in a paragraph of text with inline css,https://stackoverflow.com/questions/70536033/changing-vertical-position-of-characters-in-a-paragraph-of-text-with-inline-css,1,6,1
Access numpy functions from Visual C++,https://stackoverflow.com/questions/70536028/access-numpy-functions-from-visual-c,0,0,1
How can I join strings that are inside of an element of a multidimensional list?,https://stackoverflow.com/questions/70536027/how-can-i-join-strings-that-are-inside-of-an-element-of-a-multidimensional-list,-1,1,1
How can I get the actual size of a UIVIewController view open modally?,https://stackoverflow.com/questions/70536026/how-can-i-get-the-actual-size-of-a-uiviewcontroller-view-open-modally,0,0,1
How to group an array of objects in mongodb,https://stackoverflow.com/questions/70536021/how-to-group-an-array-of-objects-in-mongodb,0,0,1
Connect to AWS EC2 via SSH from GitLab Runner without allowing access from anywhere,https://stackoverflow.com/questions/70536020/connect-to-aws-ec2-via-ssh-from-gitlab-runner-without-allowing-access-from-anywh,0,0,1
Vis.js How to show only children/descendents of selected node?,https://stackoverflow.com/questions/70536019/vis-js-how-to-show-only-children-descendents-of-selected-node,0,0,1
Spring compare Excel and Database,https://stackoverflow.com/questions/70536017/spring-compare-excel-and-database,0,0,1
How to replace URL of private repo in local Cocoapods installation?,https://stackoverflow.com/questions/70536016/how-to-replace-url-of-private-repo-in-local-cocoapods-installation,-1,0,1
Can't go through the array object received from the service but I can see its content,https://stackoverflow.com/questions/70536009/cant-go-through-the-array-object-received-from-the-service-but-i-can-see-its-co,0,2,1
"Warning: explode() expects at most 3 parameters, 4 given",https://stackoverflow.com/questions/70536005/warning-explode-expects-at-most-3-parameters-4-given,-4,0,1
Adding countries name on the map in react maps,https://stackoverflow.com/questions/70536004/adding-countries-name-on-the-map-in-react-maps,0,0,1
Rust Get Request Response deserialize,https://stackoverflow.com/questions/70536003/rust-get-request-response-deserialize,0,0,1
I2C control on Raspberry Pi Bright Pi with dotnet,https://stackoverflow.com/questions/70536002/i2c-control-on-raspberry-pi-bright-pi-with-dotnet,0,0,1
Count the number of occurrences of an n-gram within a string,https://stackoverflow.com/questions/70535997/count-the-number-of-occurrences-of-an-n-gram-within-a-string,1,1,1
"What does ""let name(param1, param2) = .."" mean in ocaml (as opposed to just let name = ...)?",https://stackoverflow.com/questions/70535994/what-does-let-nameparam1-param2-mean-in-ocaml-as-opposed-to-just-let,0,0,1
Why doesn't my useEffect go into an infinite loop when modifying it's dependency?,https://stackoverflow.com/questions/70535992/why-doesnt-my-useeffect-go-into-an-infinite-loop-when-modifying-its-dependency,0,2,1
Log10 Y-Axis starting from 0,https://stackoverflow.com/questions/70535991/log10-y-axis-starting-from-0,0,0,1
Can't get CMAKE to compile a project,https://stackoverflow.com/questions/70535989/how-to-fix-error-cmake-error-at-cmakelists-txt6-project,2,1,1
Playing next video from list,https://stackoverflow.com/questions/70535988/playing-next-video-from-list,0,0,1
Mouse over in routes on Google Maps,https://stackoverflow.com/questions/70535984/mouse-over-in-routes-on-google-maps,0,0,1
ngOnChanges() does not trigger button click,https://stackoverflow.com/questions/70535982/ngonchanges-does-not-trigger-button-click,0,0,1
Background wont change tkinter,https://stackoverflow.com/questions/70535981/background-wont-change-tkinter,0,1,1
nsenter: USER is unset: No error information,https://stackoverflow.com/questions/70535978/nsenter-user-is-unset-no-error-information,0,0,1
SQL code won't run when CASE function is inserted?,https://stackoverflow.com/questions/70535973/sql-code-wont-run-when-case-function-is-inserted,0,1,1
Transform columns in Array from JSON,https://stackoverflow.com/questions/70535972/transform-columns-in-array-from-json,0,0,1
C# XAMl combo box displaying partial information,https://stackoverflow.com/questions/70535971/c-sharp-xaml-combo-box-displaying-partial-information,0,0,1
W3.JS Display HTML Data {{variable}} in Octobercms Page or Partial,https://stackoverflow.com/questions/70535970/w3-js-display-html-data-variable-in-octobercms-page-or-partial,0,0,1
Import openpyxl Library to Scripts Created with Custom Python Installation,https://stackoverflow.com/questions/70535969/import-openpyxl-library-to-scripts-created-with-custom-python-installation,0,0,1
Name of this technique or plugin name [closed],https://stackoverflow.com/questions/70535967/name-of-this-technique-or-plugin-name,-1,2,1
NuSoap PHP: Unexpected character \'>\' (code 62) in content after \'<\' (malformed start element?),https://stackoverflow.com/questions/70535964/nusoap-php-unexpected-character-code-62-in-content-after-malform,0,0,1
How do you update pushed route when the widget that pushed it updates?,https://stackoverflow.com/questions/70535962/how-do-you-update-pushed-route-when-the-widget-that-pushed-it-updates,0,0,1
How to stream a blob reactively using spring data r2dbc,https://stackoverflow.com/questions/70535957/how-to-stream-a-blob-reactively-using-spring-data-r2dbc,0,0,1
55 Hour Long Single Epoch Colab GPU Training Time for a Small RoBERTa-like Transformer,https://stackoverflow.com/questions/70535956/55-hour-long-single-epoch-colab-gpu-training-time-for-a-small-roberta-like-trans,0,0,1
Postman can download / display pdf but browser cannot,https://stackoverflow.com/questions/70535951/postman-can-download-display-pdf-but-browser-cannot,0,1,1
Trouble with hamburger nav using tailwind and flowbite,https://stackoverflow.com/questions/70535950/trouble-with-hamburger-nav-using-tailwind-and-flowbite,0,0,1
How to pass the proper string into Geopy to get lat & lng?,https://stackoverflow.com/questions/70535949/how-to-pass-the-proper-string-into-geopy-to-get-lat-lng,0,0,1
Return id based on existence of multiple value in mongodb,https://stackoverflow.com/questions/70535947/return-id-based-on-existence-of-multiple-value-in-mongodb,0,0,1
how to show delete button for modelformset - django,https://stackoverflow.com/questions/70535945/how-to-show-delete-button-for-modelformset-django,0,0,1
how do i write this source code for this issue? [closed],https://stackoverflow.com/questions/70535943/how-do-i-write-this-source-code-for-this-issue,-4,0,1
Using JavaScript or html to pull live data(cryptocurrency statistics from another site),https://stackoverflow.com/questions/70535940/using-javascript-or-html-to-pull-live-datacryptocurrency-statistics-from-anothe,0,2,1
CORS policy issue while reading RSS Feed in React,https://stackoverflow.com/questions/70535938/cors-policy-issue-while-reading-rss-feed-in-react,0,1,1
Azure AD B2C - Error AADB2C90018 immediately after the app registration was created,https://stackoverflow.com/questions/70535934/azure-ad-b2c-error-aadb2c90018-immediately-after-the-app-registration-was-crea,0,0,1
Entity Framework Core automatically recursively including collection for each entity,https://stackoverflow.com/questions/70535933/entity-framework-core-automatically-recursively-including-collection-for-each-en,0,1,1
Angular - setting variable values on a component that is passed to a service,https://stackoverflow.com/questions/70535932/angular-setting-variable-values-on-a-component-that-is-passed-to-a-service,0,1,1
Any quicker way than pandas fillna()?,https://stackoverflow.com/questions/70535931/what-is-the-most-optimized-way-to-replace-nan-with-0-in-a-pandas-dataframe,3,1,1
How to Determine WHEN a Synced Bookmark in Microsoft EDGE was Created,https://stackoverflow.com/questions/70535929/how-to-determine-when-a-synced-bookmark-in-microsoft-edge-was-created,0,0,1
I can't push data inside a global array Reactjs - Redux - Firstore,https://stackoverflow.com/questions/70535928/i-cant-push-data-inside-a-global-array-reactjs-redux-firstore,0,0,1
'sed: no input files' when using sed -i in a loop,https://stackoverflow.com/questions/70535925/sed-no-input-files-when-using-sed-i-in-a-loop,0,2,1
Running SQL Server 2012 in Container in Azure,https://stackoverflow.com/questions/70535923/running-sql-server-2012-in-container-in-azure,0,0,1
Determine fn output type from input type,https://stackoverflow.com/questions/70535921/determine-fn-output-type-from-input-type,1,0,1
Google Sheets: Money Display,https://stackoverflow.com/questions/70535919/google-sheets-money-display,0,0,1
CSS loads but doesn't do anything,https://stackoverflow.com/questions/70535918/css-loads-but-doesnt-do-anything,0,1,1
Add link into already existing html with href value from different element,https://stackoverflow.com/questions/70535914/add-link-into-already-existing-html-with-href-value-from-different-element,0,0,1
Selenium web automation using python: How can I handle table using selenium to find a particular row by matching text and delete that row,https://stackoverflow.com/questions/70535913/selenium-web-automation-using-python-how-can-i-handle-table-using-selenium-to-f,0,0,1
